app名称,英文名称,一级分类,安装人数,软件大小,头像地址,描述,新版本截图,开发者,apk下载地址,软件短评,版本号,id号码,vcode,新版本号
英语音标,com.binfenyinbiao.binfen,考试学习,2.7万人安装,36.13MB,https://android-artworks.25pp.com/fs08/2019/06/11/8/110_f0b0d69c011b6862cbe653f31c91fff8_con_130x130.png,"音标是学习英语的步，扎实的音标功底是学好英语的关键。本应用让你零基础由浅入深学音标，并且通过语音评测技术帮助矫正你的发音。功能包括：•48个英语音标，包含每个音标的朗读发音•录音对比、发音方法和发音口型图•相近音标的对比•常用词汇为例子，变学发音变记单词•详细的音标发音技巧和重点说明，图文并茂的方式让你学习更加方便，更能快速提高•音标发音功能,将你的声音与原声带进行对比,能够找出不足,提高发音的正确性音标是学习英语口语和听力的基础，本软件将教会你基本的音标，帮你早日实现英语听力口语流利说！ 英语音标2019更新内容修复了软件后台播放崩溃的问题 ","['https://android-screenimgs.25pp.com/fs08/2019/06/04/9/110_841a49fbd510545ce9afa36fac946a82_234x360.jpg', 'https://android-screenimgs.25pp.com/fs08/2019/06/04/3/110_024e32553b32f91f158be279a15a2b84_234x360.jpg', 'https://android-screenimgs.25pp.com/fs08/2019/06/04/4/110_08765aa05e116f98b17d1fa0cd1c17f3_234x360.jpg', 'https://android-screenimgs.25pp.com/fs08/2019/06/04/7/110_c980c58c19880a7ac3210f06df7779dd_234x360.jpg', 'https://android-screenimgs.25pp.com/fs08/2019/06/04/9/110_e2d10c9ac740df975b12f9e3943f1247_234x360.jpg']",上海异构网络科技有限公司,https://www.wandoujia.com/apps/com.binfenyinbiao.binfen/download/dot?ch=detail_normal_dl,  音标入门到精通  , 1.9.3,7609395,48, 1.9.3
拼多多,com.xunmeng.pinduoduo,网上购物,830.1万人安装,18.82MB,https://android-artworks.25pp.com/fs08/2019/06/13/2/110_c0e3820599de44d5bd530a97f89ad3d4_con_130x130.png,【拼多多——多实惠，多乐趣】拼多多，新电商开创者，是国内主流的手机购物App。用户通过发起和朋友、家人、邻居等的拼单，拼多多通过拼单了解消费者，通过机器算法进行精准推荐与匹配，让用户用更低的价格买到更好的东西，体会更多的实惠和乐趣。【拼多多——快乐大本营&非诚勿扰&我是大侦探】下载拼多多，与快乐家族相约《快乐大本营》，一起体验拼团购物的实惠与快乐；还有《非诚勿扰》，嘉宾购物送礼首选拼多多，男女嘉宾一起感受拼的乐趣；更有《我是大侦探》何老师带你一起探索购物的奥秘，当侦探和买东西都要——拼多多！【特色频道，为您省多多】1、限时秒杀： 1元秒杀、9.9元抢购，每天多个场次秒杀，精彩多多！天天秒不停！2、砍价免费拿：百款商品任你选，邀请好友帮砍价，砍到0元任你拿！ 3、签到领红包：每日App内签到，领取现金，累积10元可提现！4、天天领红包：每日上线可领取8.88元大红包，分享好友可微信提现，每天最多领取3次哦！5、免费试用：网罗众多潮流品牌，大牌新品抢先免费试用！【倾听您的声音】官方微信：拼多多（pinduoduo2015）官方微博：@拼多多官网：http://www.pinduoduo.com客服电话：400-8822-528消费者固话热线：02161897088 拼多多2019更新内容本次更新：- 6.18年中大促开始了！即日起至6月20日，全站满返，边玩儿边买，千万奖品，边买边赚，分30亿红包，优惠叠加，史无前例。9.9元秒万台液晶电视，不来拼多多，这个夏天不完整！- 优化了一些体验细节。近期更新：- 可以按店铺名搜索店铺了。 ,"['https://android-screenimgs.25pp.com/fs08/2019/06/13/0/110_2410762f047ea793df2483458d386033_234x360.jpg', 'https://android-screenimgs.25pp.com/fs08/2019/06/13/9/110_2e5be894b4e87fb71b396cab50c0bef5_234x360.jpg', 'https://android-screenimgs.25pp.com/fs08/2019/06/13/5/110_08f254ed4db58187370e4a96bed072f9_234x360.jpg', 'https://android-screenimgs.25pp.com/fs08/2019/06/13/5/110_47c69940e33d0c23af3572ed2d98e437_234x360.jpg', 'https://android-screenimgs.25pp.com/fs08/2019/06/13/4/110_516a560f4c6b89d7fd0b917a9e43e91b_234x360.jpg']",上海寻梦信息技术有限公司,https://www.wandoujia.com/apps/com.xunmeng.pinduoduo/download/dot?ch=detail_normal_dl,  9.9秒杀每天都有  , 4.60.0,6649591,46000, 4.60.0
当当,com.dangdang.buy2,网上购物,2341.3万人安装,43.3MB,https://android-artworks.25pp.com/fs08/2019/06/17/8/110_9f0b22737687006bfaabe1d0fe21aa97_con_130x130.png,1、当当秒杀：天天低价，正品秒杀2、正品保障：100%正品，放心购物3、闪电到货：625城市次日到达当当是一家综合性网购商城，中国图书零售商，一直致力于为顾客提供网上购物的高品质体验！ 阅读丈量世界！买书当然是当当！ 当当2019更新内容更新了今日必拼、拼团专场、书单分享。 ,"['https://android-screenimgs.25pp.com/fs08/2019/06/13/0/110_2410762f047ea793df2483458d386033_234x360.jpg', 'https://android-screenimgs.25pp.com/fs08/2019/06/13/9/110_2e5be894b4e87fb71b396cab50c0bef5_234x360.jpg', 'https://android-screenimgs.25pp.com/fs08/2019/06/13/5/110_08f254ed4db58187370e4a96bed072f9_234x360.jpg', 'https://android-screenimgs.25pp.com/fs08/2019/06/13/5/110_47c69940e33d0c23af3572ed2d98e437_234x360.jpg', 'https://android-screenimgs.25pp.com/fs08/2019/06/13/4/110_516a560f4c6b89d7fd0b917a9e43e91b_234x360.jpg']",北京当当科文电子商务有限公司,https://www.wandoujia.com/apps/com.dangdang.buy2/download/dot?ch=detail_normal_dl,  名品1元抢购  , 9.6.1,301109,190, 9.6.1
阿里巴巴1688批发,com.alibaba.wireless,网上购物,84.8万人安装,41.22MB,https://android-artworks.25pp.com/fs08/2019/06/11/0/110_d273e5d3ada0a3923f0542399d0af804_con_130x130.png,"【阿里巴巴1688简介】阿里巴巴1688是全球领先的B2B电商批发采购平台，云集了大量的进口淘宝卖家、天猫商城卖家、微店卖家、微商卖家、千牛用户、采购宝用户、旺旺卖家（旺信）、线下致富创业开店者,义乌购批发卖家，通过手机下载阿里巴巴APP也可帮助微商、微店网购识货挑货，招商加盟，支持一件代发，服装批发，团购，返利等业务。用户参加上新季活动（时尚女装、男装、母婴、家装建材、玩具、家居用品、日用百货、手机壳批发等）可获得购物返利红包。 【1688特色】拥有各式各样的淘宝、天猫商城、苏宁易购、京东商城等电商购物平台卖家货源，进口货源，源头好货，新品快订任您挑选，一键识货挑货，是您的商机助理，进货海购的好帮手，也提供政府采购货源，商家支持旺旺、阿里邮箱沟通，手机旺旺（旺信）24小时同步在线。 【手机阿里卖家版核心功能】 1688卖家移动工作台，支持阿里巴巴、淘宝卖家手机管店：旺旺接待、订单管理、商品管理、经营数据、发布挑货、、官方通知等功能【热门货源批发类目】1）服装批发2）手机配件批发（如手机壳批发）3）母婴用品批发4）日用百货批发5）机械五金批发6）运动户外批发7）鞋靴批发8）工艺品批发【淘货源】淘货源是针对淘宝卖家的一站式货源服务平台，为千万淘宝卖家提供经销、代销及批发、订货的组合式货源服务，同时帮助供应商建立向淘宝零售市场进行货源分销的电子化渠道网络。 1、以产地货源为核心，构建淘宝特色货源市场；2、提供买卖双方便捷的传淘宝工具、自动分账交易及库存同步等渠道管理工具3、面向买家提供平台管控的基础风险服务保障机制，48h发货、8天包退等，围绕买家塑造特色的市场服务标准； 【联系我们】官方微博：阿里巴巴官方网站：www.1688.com联系方式：4008001688您对App的反馈对我们很重要，如果您有任何问题或建议，欢迎致电联系我们。 阿里巴巴1688批发2019更新内容1、源头厂货通天下，更多源头厂货等你采购2、集货短视频上线，好货看得见 ","['https://android-screenimgs.25pp.com/fs08/2019/06/13/0/110_2410762f047ea793df2483458d386033_234x360.jpg', 'https://android-screenimgs.25pp.com/fs08/2019/06/13/9/110_2e5be894b4e87fb71b396cab50c0bef5_234x360.jpg', 'https://android-screenimgs.25pp.com/fs08/2019/06/13/5/110_08f254ed4db58187370e4a96bed072f9_234x360.jpg', 'https://android-screenimgs.25pp.com/fs08/2019/06/13/5/110_47c69940e33d0c23af3572ed2d98e437_234x360.jpg', 'https://android-screenimgs.25pp.com/fs08/2019/06/13/4/110_516a560f4c6b89d7fd0b917a9e43e91b_234x360.jpg']",阿里巴巴（中国）网络技术有限公司,https://www.wandoujia.com/apps/com.alibaba.wireless/download/dot?ch=detail_normal_dl,  选料、采购、物流一条龙服务  , 8.7.1.0,281705,2129061401, 8.7.1.0
手机淘宝,com.taobao.taobao,网上购物,4666.4万人安装,108.09MB,https://android-artworks.25pp.com/fs08/2019/05/28/8/110_679eb3839bf7640c20952b6d6559331f_con_130x130.png,手机淘宝（Android版）是阿里巴巴专为Android手机用户推出的满足其生活消费和线上购物需求的软件，具有查看附近的生活优惠信息、商品搜索、浏览、购买、支付、收藏、物流查询、旺旺沟通等在线功能，成为了用户方便快捷的生活消费入口。 手机淘宝2019更新内容1.  全新微淘升级，有更多好物种草，更快商品更新；2. 全线上线客服直播，让客服面对面为你解答购物问题，好玩、搞笑；3. 购物车优惠明细上线，所有优惠一目了然；4. 发现宝贝新乐趣，商品详情支持宝贝点赞，边看边互动。 ,"['https://android-screenimgs.25pp.com/fs08/2019/06/13/0/110_2410762f047ea793df2483458d386033_234x360.jpg', 'https://android-screenimgs.25pp.com/fs08/2019/06/13/9/110_2e5be894b4e87fb71b396cab50c0bef5_234x360.jpg', 'https://android-screenimgs.25pp.com/fs08/2019/06/13/5/110_08f254ed4db58187370e4a96bed072f9_234x360.jpg', 'https://android-screenimgs.25pp.com/fs08/2019/06/13/5/110_47c69940e33d0c23af3572ed2d98e437_234x360.jpg', 'https://android-screenimgs.25pp.com/fs08/2019/06/13/4/110_516a560f4c6b89d7fd0b917a9e43e91b_234x360.jpg']",淘宝（中国）软件有限公司,https://www.wandoujia.com/apps/com.taobao.taobao/download/dot?ch=detail_normal_dl,  手机网购，一切商品全都有  , 8.8.0,32267,243, 8.8.0
唯品会,com.achievo.vipshop,网上购物,44.3万人安装,56.78MB,https://android-artworks.25pp.com/fs08/2019/06/10/0/110_34c76e590eefa4f56ecab72e0e5a3c3e_con_130x130.png,唯品会，品牌特卖！数千名专业买手精选好货，品牌特卖，有了唯品会，从此再也不用担心买不起正品大牌啦！ 1、深度折扣 限时特卖 品类齐全 每天早10点&晚8点上新品 全场大牌深度折扣，全网最实惠 服饰、美妆、母婴、居家多种品类，满足您的一站式购物需求 2、购物体验有保障 支持货到付款，先看实物再给钱 七天无条件退货，退货返10元唯品币3、全球知名特卖电商，美国上市公司品牌直签授权，从根源杜绝假货，百分百正品保障4、八成用户成为回头客 每天帮助3亿会员节省数亿元，享受“尊贵不贵”超过85%的会员买了又买，日日约会 5、唯品快抢 每天惊喜抢购裸价到底、没有套路，准点更新，错过这个点，就没这个价！6、.发现惊喜无处不在 为你精选最热时尚资讯、好玩活动，更有明星达人——穿搭、美妆、生活、母婴各类干货轻松GET！7、开通唯品花，分期付款0压力，3/6/9/12/18期，随心分期！立即下载，开启省钱之旅吧！【意见反馈】 官方微博：@唯品会 官方微信：“唯品会” 时刻倾听你的声音。 唯品会2019更新内容【近期活动】唯品会6.16年中特卖，大牌钜献，3折封顶！ 1、口碑爆款一降到底，击穿底价不容错过！2、千万品牌特卖，大牌好货轻松带回家！3、精选夏季热销爆款，连衣裙低至49元！4、血拼折扣专区限时抢购，底价买到就是赚！6月15日晚上8点到18日晚上12点，唯品会6.16年中特卖，火热开抢！【本次更新】1、清仓列表页样式优化，操作更方便，优惠更清晰~2、退换货体验全新升级，退换货流程更加清晰~ ,"['https://android-screenimgs.25pp.com/fs08/2019/06/13/0/110_2410762f047ea793df2483458d386033_234x360.jpg', 'https://android-screenimgs.25pp.com/fs08/2019/06/13/9/110_2e5be894b4e87fb71b396cab50c0bef5_234x360.jpg', 'https://android-screenimgs.25pp.com/fs08/2019/06/13/5/110_08f254ed4db58187370e4a96bed072f9_234x360.jpg', 'https://android-screenimgs.25pp.com/fs08/2019/06/13/5/110_47c69940e33d0c23af3572ed2d98e437_234x360.jpg', 'https://android-screenimgs.25pp.com/fs08/2019/06/13/4/110_516a560f4c6b89d7fd0b917a9e43e91b_234x360.jpg']",唯品会(珠海)电子商务有限公司,https://www.wandoujia.com/apps/com.achievo.vipshop/download/dot?ch=detail_normal_dl,  全球精选正品特卖  , 6.45.3,31583,3103, 6.45.3
京东-年中618京东生日趴,com.jingdong.app.mall,网上购物,149.2万人安装,84.16MB,https://android-artworks.25pp.com/fs08/2019/06/06/9/110_feb264ba921e2fd779df9baf631a0fc2_con_130x130.png,-----挑好物，上京东-----1.新人大礼：新人专享188元大礼包2. 京东秒杀：正品限时秒，折扣享不停3. 专享特权：每日多款商品享受手机专享价4. 正品行货：100％正品行货、全国联保5. 闪电到货：211限时达、次日达、极速达、夜间配 -----2亿用户的购物首选-----1.“京东商城网购评价相对比较好。货真价实，物流也比较快，客服人员比较热情，最重要的就是活动多。京东商城值得信赖”— by“mC烟味”2.“非常好的服务型购物商城。已经用了好几年的平台，而且一直在进步”— by“猫头0305” -----满足多样购物需求-----京东APP是一款移动购物软件，具有商品搜索/浏览、评论查阅、商品购买、在线支付/货到付款、订单查询、物流跟踪、晒单/评价、返修退换货等功能，为您打造简单、快乐的生活体验。1. 劲爆促销：掌上秒杀、手机专享、降价排行、优惠券、限时满减等，优惠多多2. 生活：京东超市、京东到家、中心、电影、酒店机票等，应有尽有3. 特色频道：全球购、京东众筹、京东拍卖、白条商城、清仓二手等，无限精彩4. 精彩发现：为您呈现穿搭、智能、美妆、数码等精品推荐与时尚买手们的故事 -----总有一种方式联系我-----如果你喜欢我，请给我满分好评。为你，我们会再接再厉！如果你不喜欢我，请及时给我们反馈。为你，我们会努力改进！有任何意见或建议，可以通过以下方式联系我们：微信：京东（jdsc）微博：@京东京东客户端：我的—服务/反馈 京东-年中618京东生日趴2019更新内容618劲爆玩法火热进行中5.24-6.20全民抢免单6月6日京东超级品牌日，品牌聚惠狂欢购6月8日PLUS DAY，全新权益品牌95折6月13日超级神券日，大额神券限时疯抢6月18日热卖狂欢，24小时狂抢不停本次更新：【店铺页新增买家秀】买家真实大图评价，种草心水好物【用心评价赢得好礼】用心评价，让你和逛商品的顾客一起受益【搜索筛选属性解释】更场景化的专业属性解释，选购更轻松【催单新增商家回复】催单不着急，新增商家回复处理时间缓解您的焦虑最近更新：1.	全新首页全新体验，知你更懂你2.	放心购服务新升级，放心又贴心3.	全新搜索全新商详，好用又专业4.	App支持主题换肤，每日换新衣 ,"['https://android-screenimgs.25pp.com/fs08/2019/06/17/5/110_dc4cc43d39d3951c2545d2021c828f87_234x360.jpg', 'https://android-screenimgs.25pp.com/fs08/2019/06/17/9/110_50b01d1f983ff8032f3d021d7a699457_234x360.jpg', 'https://android-screenimgs.25pp.com/fs08/2019/06/17/0/110_92bb44983a198db279d96edaec377b38_234x360.jpg', 'https://android-screenimgs.25pp.com/fs08/2019/06/17/3/110_f4e84c299d0521c0588d290e721015c7_234x360.jpg']",北京京东叁佰陆拾度电子商务有限公司,https://www.wandoujia.com/apps/com.jingdong.app.mall/download/dot?ch=detail_normal_dl,  万千新品，天天折扣享不停  , 8.1.0,279987,67387, 8.1.0
苏宁易购,com.suning.mobile.ebuy,网上购物,55.7万人安装,87.77MB,https://android-artworks.25pp.com/fs08/2019/05/20/11/106_748eb84413721eada59be4da86516e06_con_130x130.png,"苏宁易购手机客户端，让购物更简单！ 百万商品，低价，国内外品牌旗舰店厂家直供，正品承诺，全国1600多家实体门店,让您购物无忧！【大聚惠】频道,为您服饰,鞋帽,家电,数码,母婴,音像等热门商品团购,聚划算,优惠促销,打折,秒杀,限时折扣优惠信息,聚优品,惠生活,省钱放心上苏宁，穿搭指南，生活导购，社区分享，让您购物不单调！ ","['https://android-screenimgs.25pp.com/fs08/2019/06/17/5/110_dc4cc43d39d3951c2545d2021c828f87_234x360.jpg', 'https://android-screenimgs.25pp.com/fs08/2019/06/17/9/110_50b01d1f983ff8032f3d021d7a699457_234x360.jpg', 'https://android-screenimgs.25pp.com/fs08/2019/06/17/0/110_92bb44983a198db279d96edaec377b38_234x360.jpg', 'https://android-screenimgs.25pp.com/fs08/2019/06/17/3/110_f4e84c299d0521c0588d290e721015c7_234x360.jpg']",苏宁云商集团股份有限公司,https://www.wandoujia.com/apps/com.suning.mobile.ebuy/download/dot?ch=detail_normal_dl,  注册领199红包  , 7.7.3,44733,274, 7.7.3
淘集集,com.huanshou.taojj,网上购物,28万人安装,28.13MB,https://android-artworks.25pp.com/fs08/2019/06/18/3/110_07e9f99fabca8cf35691cdfcdf0e7ad8_con_130x130.png,【淘集集-全场一元起购物】淘集集是一款品质更好，价格更低还能赚钱的APP，云集了百货、美妆、鞋包、食品、服饰、内衣、手机用品、母婴、家纺、电器、运动类、汽车内用物件等全方位生活用品，是不爱上街却爱淘宝的你最好的选择，每一件商品精挑细选，每一个价格都击穿你的想象底线。【买的多 赚得多】全平台购物成功分享新用户即可获得红包，分享好友拆红包得现金，买的多赚得多，快来和你的朋友、家人、同事一起来购物赚钱吧~让身边的好友们一起越买钱包越鼓【特色专区活动，为您省多多】一元集市、十元五件、秒杀专区，厂家特卖，百款商品天天特价，天天有货满足各类人群需求赚赚：购买分享最多可享受免单名品折扣：网络正品好货，购实惠，购放心!新用户更多优惠，详见APP！聆听您的声音官方客服：4006112666官方网址：www.taojiji.com招商电话：021-66690601招商邮箱：zhaoshang@taojiji.com 淘集集2019更新内容淘集集2.24.2版本更新功能说明支付宝新人送8元通过淘集集结算页面注册支付宝，即可获得8元现金支付宝老用户也有好礼相送哦~新客任务不用等，最快当天全完成，立领最高60元现金奖励新手注册淘集集即赠1元现金下单还有额外现金红包不限量瓜分以上所得现金支持微信/支付宝提现哦~淘集集，买的多，赚的多 ,"['https://android-screenimgs.25pp.com/fs08/2019/06/17/5/110_dc4cc43d39d3951c2545d2021c828f87_234x360.jpg', 'https://android-screenimgs.25pp.com/fs08/2019/06/17/9/110_50b01d1f983ff8032f3d021d7a699457_234x360.jpg', 'https://android-screenimgs.25pp.com/fs08/2019/06/17/0/110_92bb44983a198db279d96edaec377b38_234x360.jpg', 'https://android-screenimgs.25pp.com/fs08/2019/06/17/3/110_f4e84c299d0521c0588d290e721015c7_234x360.jpg']",上海欢兽实业有限公司,https://www.wandoujia.com/apps/com.huanshou.taojj/download/dot?ch=detail_normal_dl,  全场一元起购物  , 2.24.2,7673016,329, 2.24.2
美团,com.sankuai.meituan,网上购物,93.1万人安装,101.94MB,https://android-artworks.25pp.com/fs08/2019/06/13/0/110_01d34560730ab3d2877ad7c16023bcec_con_130x130.png,【特色服务】1. 吃喝玩乐一应俱全◇餐厅订座全国上线，提前排队再不等位◇外卖订餐水果宵夜，酒店旅游周边推荐2. 旅游出行一站搞定◇火车票云抢票，自动占座送票上门◇机票低价优质出行，船票门票在线预订◇美团打车优惠不停，快车专车出租车便捷出发3. 全国影讯在线选座◇影院会员卡商家券，电影购票享超值更优惠◇热映影片团购订座，大片预告电影抢先看起【产品特点】吃喝玩乐全都有：美食精选、外卖订餐、酒店预订、旅游团购、机票打折、电影特价、打车出租车等团购实惠根本停不下来！◇情侣约会：吃美食、看电影、住酒店、去旅游；◇懒宅点餐：美食、水果、鲜花、下午茶、超市百货；◇朋友轰趴：按摩足疗、KTV、、桌游电玩；◇闺蜜逛街：美容、美发、美甲、瑜伽、舞蹈；◇旅游周边：机票、火车票、景点门票、跟团游◇打车出行：美团打车，快车、专车、出租车美团、美团打车、美团外卖、美团酒店、猫眼电影客户端，为您提供美食、打车、外卖、酒店、旅游、电影、KTV、机票、火车票、特价门票、洗车养车出租车等全面服务。同时兼具出行，外卖，大众点评等热门平台的热门服务，为用户提供打车，美食，电影，门票等相关一系列出行服务。除各种实惠，美团网提供用户消费评价、商家评分、商家信息查询等功能，旨在为用户提供好的服务！【关于美团】美团网（meituan.com）成立于2010年3月4日，汇聚美食、外卖、酒店、旅游、电影、门票、打车、出租车等生活服务于一体的综合信息网站。秉承消费者至上的价值观，在业内率先推出“7天内未消费无条件退款”和“美团券过期未消费无条件退款”等消费者保障条款，为消费者放心消费提供权益保障。相关应用：大众点评、美团打车、外卖、出行、糯米、口碑、饿了么、携程旅行、、淘票票、格瓦拉、淘宝、京东、小象生鲜 美团2019更新内容【美团】App全新色彩，吃喝玩乐更精彩 【门票】暑期出游清凉价，门票5折起 【美团打车】聚合多个品牌，一键更快出发。更多城市陆续开通，敬请关注 ,"['https://android-screenimgs.25pp.com/fs08/2019/06/17/5/110_dc4cc43d39d3951c2545d2021c828f87_234x360.jpg', 'https://android-screenimgs.25pp.com/fs08/2019/06/17/9/110_50b01d1f983ff8032f3d021d7a699457_234x360.jpg', 'https://android-screenimgs.25pp.com/fs08/2019/06/17/0/110_92bb44983a198db279d96edaec377b38_234x360.jpg', 'https://android-screenimgs.25pp.com/fs08/2019/06/17/3/110_f4e84c299d0521c0588d290e721015c7_234x360.jpg']",北京三快科技有限公司,https://www.wandoujia.com/apps/com.sankuai.meituan/download/dot?ch=detail_normal_dl,  吃喝玩乐全都有  , 10.0.401,33857,1000000401, 10.0.401
