app名称,英文名称,一级分类,安装人数,软件大小,头像地址,描述,新版本截图,开发者,apk下载地址,软件短评,版本号,id号码,vcode,新版本号
飞猪,com.taobao.trip,旅游出行,46.5万人安装,56.39MB,https://android-artworks.25pp.com/fs08/2019/06/06/8/110_36bd4ffe907f4539b2ddb2de9cd116ca_con_130x130.png,飞猪--享受大不同！ 飞猪是阿里巴巴集团旗下旅行品牌，提供机票、酒店、火车票、汽车票、景点门票、用车、周末游、跟团游、自由行、自驾游、邮轮、旅游度假产品任您选！精选攻略、出行保险，旨在为您提供优惠、便捷、高性价比的出行服务。[精彩活动]1.「新人大礼包」首次下载飞猪App，即享百元飞猪出行大礼包；2.「特价机票」每周四日低至2折，1元飞世界；3.「特惠酒店」五星酒店五折住；4.「飞猪会员日」会员可直接对等成为国内外五星酒店、国内各大知名酒店集团的银卡、金卡、白金卡，并尊享该等级所有会员权益；5.「飞猪特卖」全网高性价比旅行商品，每天等你来； [特色服务]1.「周边好去处」、「全球第一站」，分享旅行见闻，带你发现更多精彩； 2.享受先行赔付的「放心飞」服务，航空公司标准的退改签服务； 3.专享「信用住」酒店，免押金、免查房、免排队； 4.随时查看全球热门「目的地」攻略，旅游指南、行程游记、景点、美食、购物全掌握； 5.「领里程」当钱花，好货兑不停。 主要产品与服务： [机票] - 拥有各大航空公司旗舰店和优质代理商的全程服务；  - 机票价格透明，服务保障，按照航空公司标准进行退改签；- 手机值机在线选座，低价及时提醒、实时查询航班动态。[酒店] - 海量酒店房型照片及真实住客的点评； - 支持返现，「信用住」首单专享大红包优惠。[火车票]  - 极速云抢票，支持预约抢票、实时捡漏、VIP抢票； - 支持实时查询、上车补票、在线退改签； - 票种多样，支持票、票、儿童票； [汽车票] - 零手续费快速购票，覆盖全国随时出发，在线退票有保障。 [门票] - 出票保障、入园保障：卖家原因导致用户不能以订单价正常入园，卖家包退，并赔付交易额的30%。 - 比价不必东奔西走：近2000家商家任您挑选；千家景区直连，优惠一减到底； - 凭芝麻信用专享免费预订、先玩后付「未来景区」新体验； [度假] - 「周边好去处」，给您的周末游玩出谋划策，精彩周末，尽在掌握； - 「品质跟团游」，为您提供国内、国外热门目的地的品质跟团线路，让您放心看世界！ 飞猪2019更新内容飞猪这一波的更新，一个字，爽！两个字，很赞！ 【汽车票】汽车票首页样式升级改版，界面更友好，购买汽车票好赞！ 【火车票】火车票购买与退改签优化，使用起来更赞了~ 【度假】商品详情页升级改版，搜索过什么轻松找回，端午出去耍，轻松搜索度假商品~ 【国际机票】国际机票页面优化，真的不要太好用啊~ 【酒店】酒店首页，搜索更加精准，这一波优化更新，真的好贴心~ 【目的地】目的地频道升级改版，信息整理更加清晰；到达目的地，别忘记打开飞猪，探索一下当地哦！ 【飞猪购】飞猪购搜索功能优化，买起来啦喂！ 点击更新，飞猪和你在新功能里见面~~ 提前祝大家：端午节玩的开心！ ,"['https://android-screenimgs.25pp.com/fs08/2019/06/14/0/106_dcc33a2b4c57e5d638b9cf88a249b722_234x360.jpg', 'https://android-screenimgs.25pp.com/fs08/2019/06/14/8/106_376ee8113fc50769be8d937bec6d6273_234x360.jpg', 'https://android-screenimgs.25pp.com/fs08/2019/06/14/2/106_b723211f1010dc84fef6db5fb0a4df65_234x360.jpg', 'https://android-screenimgs.25pp.com/fs08/2019/06/14/1/106_9cf87022d314b122a2a256dc70d9adb9_234x360.jpg', 'https://android-screenimgs.25pp.com/fs08/2019/06/14/7/106_c5a0eb7a91b13518741320e59f4726ee_234x360.jpg']",支付宝（中国）网络技术有限公司,https://www.wandoujia.com/apps/com.taobao.trip/download/dot?ch=detail_normal_dl,  用手机玩转你的旅行，爱梦想去旅行！  , 9.3.0.102,43129,8100112, 9.3.0.102
掌上公交,com.mygolbs.mybus,旅游出行,14.6万人安装,34.46MB,https://android-artworks.25pp.com/fs08/2019/06/18/8/110_83b90c3188608d9e875987dec7fa76d4_con_130x130.png,掌上公交（又名：掌上出行），支持扫码乘车，准确、好用、简洁的实时公交查询，是全国较早的实时公交，我们10载耕耘，为的是你100分的满意；目前数据已覆盖全国160多个城市，例如：北京市顺义区、广州、深圳、天津、重庆、厦门、福州、贵阳、长沙、株洲、常州、开封、石家庄、保定、徐州、南宁、南昌、温州、台州、银川、南京、海口、呼和浩特、丽江等等，我们的产品全国覆盖城市多、活跃用户多，数据都得到各地公交企业或交通局授权；深度打造的用户体验、功能细节等方面胜人一筹；希望能为千百万用户高质量的实时出行服务。。。 掌上公交2019更新内容更精准、更快速、更完整 ,"['https://android-screenimgs.25pp.com/fs08/2019/06/14/0/106_dcc33a2b4c57e5d638b9cf88a249b722_234x360.jpg', 'https://android-screenimgs.25pp.com/fs08/2019/06/14/8/106_376ee8113fc50769be8d937bec6d6273_234x360.jpg', 'https://android-screenimgs.25pp.com/fs08/2019/06/14/2/106_b723211f1010dc84fef6db5fb0a4df65_234x360.jpg', 'https://android-screenimgs.25pp.com/fs08/2019/06/14/1/106_9cf87022d314b122a2a256dc70d9adb9_234x360.jpg', 'https://android-screenimgs.25pp.com/fs08/2019/06/14/7/106_c5a0eb7a91b13518741320e59f4726ee_234x360.jpg']",厦门搜谷信息科技有限公司,https://www.wandoujia.com/apps/com.mygolbs.mybus/download/dot?ch=detail_normal_dl,  城市实时公交数据服务，让你轻松赶高峰  , 3.0.9,29355,131, 3.0.9
亿通行,enfc.metro,旅游出行,5.8万人安装,50.3MB,https://android-artworks.25pp.com/fs08/2019/06/11/10/110_d95189966f9f67728aabc0a7a6faab16_con_130x130.png,亿通行App，北京地铁在线购票功能，是上班族和来京差旅人士必备的北京地铁出行神器。有了亿通行，从此告别现金、押金和兑零，告别排队与丢卡，告别问路和百度，不管您是在北京工作生活，还是来北京出差旅行，这个北京地铁的权威应用您值得拥有！提前在手机上买好票，到车站取票机前轻松一扫，车票秒出，还能一次买多张。更有二维码乘车模式，手机码就是地铁票，进站乘车效率高，先乘后付，从此不再为充值和买票排长队！对北京地铁路线不熟悉？亿通行地铁乘车数据由轨道交通指挥中心权威发布，准实时更新，在线查询优选乘车路线，乘车出行更从容！北京地铁的互联网时代现已开启，北京地铁内的官方购票应用，为您更方便、快捷、人性化的地铁互联网移动支付功能。【支持城市】北京【产品功能】三大功能：在线购票、扫码进／出站、路线查询。在线购票：在线购买地铁票，免去排队、兑零、忘带现金和交通卡的烦恼。路线查询：地铁路线尽在掌握，快捷路线一查就知。扫码进／出站：刷码进出站，让地铁出行比快更快。【意见反馈】客服热线：96123新浪微博：@亿通行App问题帮助 亿通行2019更新内容1.亿通行首页新变化，出行服务更便捷2.会员钱包特权多，省的不止一点点3.商城便宜捡不完，羊毛薅不停4.全新信息流，精彩内容不错过 ,"['https://android-screenimgs.25pp.com/fs01/2015/01/20/6/102_7d24e7b31a22316077b7119d55213888_234x360.jpg', 'https://android-screenimgs.25pp.com/fs08/2019/05/24/3/110_f1087e506b494ee73c230d5c94e0bba6_234x360.jpg', 'https://android-screenimgs.25pp.com/fs08/2019/05/24/6/110_5493cde4a3fee05504fec956dde2b756_234x360.jpg', 'https://android-screenimgs.25pp.com/fs08/2019/05/24/7/110_93ccc2550bd125dd5383b8fb777b39a9_234x360.jpg', 'https://android-screenimgs.25pp.com/fs08/2019/05/24/4/110_9c4bbb29d45742d8ea968dbd540ecb98_234x360.jpg', 'https://android-screenimgs.25pp.com/fs08/2019/05/24/5/110_de1a712ddd2c7553369308b787d87c0e_234x360.jpg']",北京如易行科技有限公司,https://www.wandoujia.com/apps/enfc.metro/download/dot?ch=detail_normal_dl,  让城市生活更便捷  , 3.1.0,7643654,3100036, 3.1.0
百度地图位置监护,com.baidu.BaiduMap.customGear,旅游出行,7万人安装,22.51MB,https://android-artworks.25pp.com/fs08/2016/06/09/8/1_07bc4fd9bb951f210b3cdae8126e6f13_con_130x130.png,百度地图，位置监护，前所未有，定制专版；1.随时关注对方位置；2.手绘地理围栏，随时知晓被监护人动态；3.可以同时监护多人，不用担心上限；4.接受他人关注请求，紧急情况一键求助； 百度地图位置监护更新内容定制版本，新版本上线 ,"['https://android-screenimgs.25pp.com/fs01/2015/01/20/6/102_7d24e7b31a22316077b7119d55213888_234x360.jpg', 'https://android-screenimgs.25pp.com/fs08/2019/05/24/3/110_f1087e506b494ee73c230d5c94e0bba6_234x360.jpg', 'https://android-screenimgs.25pp.com/fs08/2019/05/24/6/110_5493cde4a3fee05504fec956dde2b756_234x360.jpg', 'https://android-screenimgs.25pp.com/fs08/2019/05/24/7/110_93ccc2550bd125dd5383b8fb777b39a9_234x360.jpg', 'https://android-screenimgs.25pp.com/fs08/2019/05/24/4/110_9c4bbb29d45742d8ea968dbd540ecb98_234x360.jpg', 'https://android-screenimgs.25pp.com/fs08/2019/05/24/5/110_de1a712ddd2c7553369308b787d87c0e_234x360.jpg']",未知,https://www.wandoujia.com/apps/com.baidu.BaiduMap.customGear/download/dot?ch=detail_normal_dl,  随时随地关注他的位置  , 7.1.0,6561183,533, 7.1.0
奥维互动地图,com.ovital.ovitalMap,旅游出行,21.6万人安装,26.75MB,https://android-artworks.25pp.com/fs08/2019/05/14/9/106_92ef18b137603ef6490ff14021f97190_con_130x130.png,奥维互动地图浏览器集多种知名地图于一体，拥有强大的设计功能与地理信息展现技术，可满足各行各业地理信息规划的需求。它不仅是您工作上的好帮手，也是您探索未知世界的伴侣。,"['https://android-screenimgs.25pp.com/fs01/2015/01/20/6/102_7d24e7b31a22316077b7119d55213888_234x360.jpg', 'https://android-screenimgs.25pp.com/fs08/2019/05/24/3/110_f1087e506b494ee73c230d5c94e0bba6_234x360.jpg', 'https://android-screenimgs.25pp.com/fs08/2019/05/24/6/110_5493cde4a3fee05504fec956dde2b756_234x360.jpg', 'https://android-screenimgs.25pp.com/fs08/2019/05/24/7/110_93ccc2550bd125dd5383b8fb777b39a9_234x360.jpg', 'https://android-screenimgs.25pp.com/fs08/2019/05/24/4/110_9c4bbb29d45742d8ea968dbd540ecb98_234x360.jpg', 'https://android-screenimgs.25pp.com/fs08/2019/05/24/5/110_de1a712ddd2c7553369308b787d87c0e_234x360.jpg']",北京元生华网,https://www.wandoujia.com/apps/com.ovital.ovitalMap/download/dot?ch=detail_normal_dl,  驴友穿越、出国旅游的必备地图  , 8.0.8,314195,808, 8.0.8
北斗地图,com.beidou.android.beidoumap,旅游出行,8.3万人安装,45.37MB,https://android-artworks.25pp.com/fs08/2018/06/19/10/2_53e54626737f0cb45159e32988b927ab_con_130x130.png,北斗地图，一路坦途【功能特色】,"['https://android-screenimgs.25pp.com/fs01/2015/01/20/6/102_7d24e7b31a22316077b7119d55213888_234x360.jpg', 'https://android-screenimgs.25pp.com/fs08/2019/05/24/3/110_f1087e506b494ee73c230d5c94e0bba6_234x360.jpg', 'https://android-screenimgs.25pp.com/fs08/2019/05/24/6/110_5493cde4a3fee05504fec956dde2b756_234x360.jpg', 'https://android-screenimgs.25pp.com/fs08/2019/05/24/7/110_93ccc2550bd125dd5383b8fb777b39a9_234x360.jpg', 'https://android-screenimgs.25pp.com/fs08/2019/05/24/4/110_9c4bbb29d45742d8ea968dbd540ecb98_234x360.jpg', 'https://android-screenimgs.25pp.com/fs08/2019/05/24/5/110_de1a712ddd2c7553369308b787d87c0e_234x360.jpg']",未知,https://www.wandoujia.com/apps/com.beidou.android.beidoumap/download/dot?ch=detail_normal_dl,  北斗地图，一路坦途 【功能特色】 ⊙实时、高精度，准确定位导航 ⊙海量交通大数据，助力智慧交通 ⊙避  , 9.3.2.6af7d91,7828207,820010502, 9.3.2.6af7d91
天眼,com.example.artilleryandroid,旅游出行,17.7万人安装,19.18MB,https://android-artworks.25pp.com/fs08/2019/05/07/6/110_cfa56f11be09d9c3515c83da395616f5_con_130x130.png,此软件为一款具有坐标解算功能的电子地图软件，主要用于野外勘探、工程测量、测绘作业、地形学作业和旅游探险等方面。该软件依据国测局的公开数据开发了以下功能：1.在电子地图(含三维电子地图)上量算点位坐标、多点行程距离、两点方向、多边形面积功能；2.实时显示当前位置及位置坐标数据(经纬度和高斯直角坐标)；3.根据经纬度坐标或者高斯直角坐标寻找电子地图相应位置(也可进行经纬度和直角坐标的相互转换计算)；4.实时显示及编辑航迹；5.在地图上自由添加分享兴趣点位；6.与好友进行简单的通信及互相分享实时位置；7.基于密位制的公式解算，含坐标正运算、逆运算、三角边长、整理交会成果、两点后方交会、三点交会、单点高程等功能。该软件了灵活的参数设置功能和界面设置功能，可在“参数设置”中自由修改界面数据隐显和坐标系参数(北京54、西安80、大地2000、自定义等)，在行业应用方面具有良好的实际应用价值。 天眼2019更新内容此版本修正了少量bug。在此恳请兄弟们继续提出宝贵意见！ ,"['https://android-screenimgs.25pp.com/fs01/2015/01/20/6/102_7d24e7b31a22316077b7119d55213888_234x360.jpg', 'https://android-screenimgs.25pp.com/fs08/2019/05/24/3/110_f1087e506b494ee73c230d5c94e0bba6_234x360.jpg', 'https://android-screenimgs.25pp.com/fs08/2019/05/24/6/110_5493cde4a3fee05504fec956dde2b756_234x360.jpg', 'https://android-screenimgs.25pp.com/fs08/2019/05/24/7/110_93ccc2550bd125dd5383b8fb777b39a9_234x360.jpg', 'https://android-screenimgs.25pp.com/fs08/2019/05/24/4/110_9c4bbb29d45742d8ea968dbd540ecb98_234x360.jpg', 'https://android-screenimgs.25pp.com/fs08/2019/05/24/5/110_de1a712ddd2c7553369308b787d87c0e_234x360.jpg']",河北营观图创科技有限公司,https://www.wandoujia.com/apps/com.example.artilleryandroid/download/dot?ch=detail_normal_dl,  GPS坐标地图  , 1.82,7601909,82, 1.82
顺风车,com.free_ride.yiwei,旅游出行,1.9万人安装,35.94MB,https://android-artworks.25pp.com/fs08/2019/06/18/10/110_b54c8bdbaa906c6807e2e310670fc5bf_con_130x130.png,【顺风车】显示全国合地每天的实时的拼车信息	【拼车】车主可以发布信息，也可以在线抢单	【滴答顺风车】乘客可以发布信息，也可以在线购票	【嘀嗒顺风车】实行爽约金制度，所有的线路信息均真实可靠	【嘀嗒出行】我是车主，搜索线路，开始抢单，乘客，出行赚钱	【滴答出行】齐备的行程短信通知及应用内通知，让你出行无忧	【滴答】我是乘客，搜索线路，开始购票，车主，便捷出行	【嘀嗒】这里每天有上万条全国各地的实时拼车信息	【嘀嗒拼车】希望让出行更加便宜和便利	【一喂顺风车】希望让天更蓝，水更清 顺风车2019更新内容1、补贴再升级，新增O佣金入口	2、优化认证认证流程	3、优化微信提现	4、优化身份切换及订单显示	5、我们一直在努力	 ,"['https://android-screenimgs.25pp.com/fs01/2015/01/20/6/102_7d24e7b31a22316077b7119d55213888_234x360.jpg', 'https://android-screenimgs.25pp.com/fs08/2019/05/24/3/110_f1087e506b494ee73c230d5c94e0bba6_234x360.jpg', 'https://android-screenimgs.25pp.com/fs08/2019/05/24/6/110_5493cde4a3fee05504fec956dde2b756_234x360.jpg', 'https://android-screenimgs.25pp.com/fs08/2019/05/24/7/110_93ccc2550bd125dd5383b8fb777b39a9_234x360.jpg', 'https://android-screenimgs.25pp.com/fs08/2019/05/24/4/110_9c4bbb29d45742d8ea968dbd540ecb98_234x360.jpg', 'https://android-screenimgs.25pp.com/fs08/2019/05/24/5/110_de1a712ddd2c7553369308b787d87c0e_234x360.jpg']",杭州一喂智能科技有限公司,https://www.wandoujia.com/apps/com.free_ride.yiwei/download/dot?ch=detail_normal_dl,  8300万用户  , 5.10.0,7685409,80, 5.10.0
曹操出行,cn.caocaokeji.user,旅游出行,5.8万人安装,67.51MB,https://android-artworks.25pp.com/fs08/2019/06/12/4/110_74ba95d25b078e1cac2fd44ff5254943_con_130x130.png,曹操出行是吉利集团战略投资的互联网+新能源出行服务平台，为用户提供安全、便捷、低碳、高品质的一站式出行解决方案。公车公营，已获得网络预约出租汽车经营许可，目前开通服务的城市有杭州、宁波、南京、青岛、厦门、成都、天津、太原、大连、苏州、广州、北京、深圳、哈尔滨、武汉、营口、长沙、西安、金华、佛山、上海、兰州、郑州、贵阳、义乌。即将开通服务的城市有合肥、海口等【拒绝溢价】证·高峰、雨天不溢价【专注品质】·全面导入伦敦出租车近百年的司机培训认证体系·成立曹操学院，培养优质服务专业司机，给用户带来安全、便捷、低碳及高品质体验【低碳环保】·新能源专车，节能环保，不让污染上路·新能源车辆能耗不到传统汽车的1/3【安全舒适】·平台与纯电动汽车互联互通，通过智能数据计算，提高服务及运营效率，保证用户出行安全·全车5座乘客保险总额300万元【创新服务】·基础服务：新能源专车及时接驾，公车公营，动态折扣，高性价比·特色服务：新能源专车，预约服务，接送机，城际快车等·增值服务：司机+保镖专车、翻译专车、特护专车、导游专车等·大客户服务：政府集团企业客户一站式服务，一键接驾，预约服务，会务接待，对公结算 曹操出行2019更新内容曹操出行预祝您端午快乐！ 1. 视觉与体验优化2. 修复了一些缺陷3. 喜欢曹操出行吗？请给我们评价吧！您的反馈能帮助我们把曹操出行做得更好～ ,"['https://android-screenimgs.25pp.com/fs08/2019/01/04/2/134df5b7089de14e1a0488269bce4e13_234x360.jpg', 'https://android-screenimgs.25pp.com/fs08/2019/01/04/1/3fe5302b5c8978eb9b026719f85d3846_234x360.jpg', 'https://android-screenimgs.25pp.com/fs08/2019/01/04/1/7fc5369febb6c6026b6d8e9015202413_234x360.jpg', 'https://android-screenimgs.25pp.com/fs08/2019/01/04/3/b6b7d9af78a50e8d21b98cb00eefa7e0_234x360.jpg', 'https://android-screenimgs.25pp.com/fs08/2019/01/04/0/680f08af9eec93b7aaec1ae14d047e72_234x360.jpg']",杭州优行科技有限公司,https://www.wandoujia.com/apps/cn.caocaokeji.user/download/dot?ch=detail_normal_dl,  高峰雨天 不溢价  , 4.2.7,6670324,42700, 4.2.7
摩拜单车,com.mobike.mobikeapp,旅游出行,10.5万人安装,34.05MB,https://android-artworks.25pp.com/fs08/2019/06/13/8/110_dc779329334d6ded5fc37d0cbb7ac18e_con_130x130.png,清风徐来，春暖花开。骑上摩拜，感受城市之美~使用摩拜单车的 8 大理由： 1. 摩拜单车好骑可靠，不掉链子2. 顺畅扫码，秒开秒走，7×24小时不间断3. 骑红包车能赚现金，指定区域停放金额翻倍4. 一秒落锁结束行程，自动计费完成5. 运营区域内任意停车点停车，指定停车点更享6. 购买骑行套餐，短途出行更实惠7. 打开蓝牙靠近车锁，体验开锁“黑科技”8. 绿色健康出行，畅享低碳骑行新生活Mobike - Smart Dockless Bike Share联系我们：客服电话：4008117799邮箱：customerservice@mobike.com 摩拜单车2019更新内容优化产品功能，修复bug。提升用户体验！ ,"['https://android-screenimgs.25pp.com/fs08/2019/01/04/2/134df5b7089de14e1a0488269bce4e13_234x360.jpg', 'https://android-screenimgs.25pp.com/fs08/2019/01/04/1/3fe5302b5c8978eb9b026719f85d3846_234x360.jpg', 'https://android-screenimgs.25pp.com/fs08/2019/01/04/1/7fc5369febb6c6026b6d8e9015202413_234x360.jpg', 'https://android-screenimgs.25pp.com/fs08/2019/01/04/3/b6b7d9af78a50e8d21b98cb00eefa7e0_234x360.jpg', 'https://android-screenimgs.25pp.com/fs08/2019/01/04/0/680f08af9eec93b7aaec1ae14d047e72_234x360.jpg']",北京摩拜科技有限公司,https://www.wandoujia.com/apps/com.mobike.mobikeapp/download/dot?ch=detail_normal_dl,  让自行车回归城市  , 8.17.1,6761262,81701, 8.17.1
高铁管家,com.gtgj.view,旅游出行,6.3万人安装,75.27MB,https://android-artworks.25pp.com/fs08/2019/05/20/2/106_b508a91304dc9256b664d906a441a42c_con_130x130.png,高铁管家，2亿出行用户的选择！随时随地购买火车票，支持学生票、儿童票、残军票,"['https://android-screenimgs.25pp.com/fs08/2019/01/04/2/134df5b7089de14e1a0488269bce4e13_234x360.jpg', 'https://android-screenimgs.25pp.com/fs08/2019/01/04/1/3fe5302b5c8978eb9b026719f85d3846_234x360.jpg', 'https://android-screenimgs.25pp.com/fs08/2019/01/04/1/7fc5369febb6c6026b6d8e9015202413_234x360.jpg', 'https://android-screenimgs.25pp.com/fs08/2019/01/04/3/b6b7d9af78a50e8d21b98cb00eefa7e0_234x360.jpg', 'https://android-screenimgs.25pp.com/fs08/2019/01/04/0/680f08af9eec93b7aaec1ae14d047e72_234x360.jpg']",深圳市活力天汇科技股份有限公司,https://www.wandoujia.com/apps/com.gtgj.view/download/dot?ch=detail_normal_dl,  随时随地订票，退票，坐火车出必备  , 7.1.3,508785,177, 7.1.3
Google地球,com.google.earth,旅游出行,37.6万人安装,9.45MB,https://android-artworks.25pp.com/fs08/2016/07/18/5/2_05884b87f8099b8813d9fb7b48744fc3_con_130x130.png,使用 Android 版 Google 地球，只需轻轻滑动指尖，便可在整个星球上纵横驰骋。您可以探索遥远的大陆，或者重温儿时的旧居。集成到地球中的 Google 地图街景视图可让您穿街走巷、品味世界。您可以浏览到包括公路、边界、地点、照片等在内的各种图层，可以访问 Google 地球图库，发掘有趣的地图细节，例如实时地震、航行中的飞机、远足小径、城市旅游路线等。 ,"['https://android-screenimgs.25pp.com/fs08/2019/01/04/2/134df5b7089de14e1a0488269bce4e13_234x360.jpg', 'https://android-screenimgs.25pp.com/fs08/2019/01/04/1/3fe5302b5c8978eb9b026719f85d3846_234x360.jpg', 'https://android-screenimgs.25pp.com/fs08/2019/01/04/1/7fc5369febb6c6026b6d8e9015202413_234x360.jpg', 'https://android-screenimgs.25pp.com/fs08/2019/01/04/3/b6b7d9af78a50e8d21b98cb00eefa7e0_234x360.jpg', 'https://android-screenimgs.25pp.com/fs08/2019/01/04/0/680f08af9eec93b7aaec1ae14d047e72_234x360.jpg']",Google Inc.,https://www.wandoujia.com/apps/com.google.earth/download/dot?ch=detail_normal_dl,  随心所欲观察世界的每一个角落  , 9.2.0.3,280219,173121803, 9.2.0.3
