app名称,英文名称,一级分类,安装人数,软件大小,头像地址,描述,新版本截图,开发者,apk下载地址,软件短评,版本号,id号码,vcode,新版本号
全能指纹解锁,com.floor25.ilock,手机美化,6.1万人安装,3.61MB,https://android-artworks.25pp.com/fs08/2016/06/06/4/1_fd0cc9653805aa42368bb038345f14c3_con_130x130.png,全能指纹解锁，为你带来一款免费、绿色无广告的安全锁屏工具。,"['https://android-screenimgs.25pp.com/fs08/2018/12/13/8/110_7578cf128a5de49f0190f717e5b6c94e_234x360.jpg', 'https://android-screenimgs.25pp.com/fs08/2018/12/13/2/110_91ca9d0603f68ee1bccc8e1bf8ed4277_234x360.jpg', 'https://android-screenimgs.25pp.com/fs08/2018/12/13/7/110_94cb1628e4e27d6d815f90074bbe67e1_234x360.jpg', 'https://android-screenimgs.25pp.com/fs08/2018/12/13/8/110_4f75faa67643a640ef894f0f7e000d88_234x360.jpg', 'https://android-screenimgs.25pp.com/fs08/2018/12/13/4/110_deab95ea908ba6757adc6775ff223992_234x360.jpg']",来自互联网,https://www.wandoujia.com/apps/com.floor25.ilock/download/dot?ch=detail_normal_dl,  安全锁屏，指纹解锁  , 1.0.1,6198496,3, 1.0.1
小妖精美化,com.xjlmh.classic,手机美化,2.9万人安装,32.33MB,https://android-artworks.25pp.com/fs08/2019/06/18/11/2_f690bd727879fadc36b0259af5c755ce_con_130x130.png,独具创意的美化软件 (始于2016),"['https://android-screenimgs.25pp.com/fs08/2018/12/13/8/110_7578cf128a5de49f0190f717e5b6c94e_234x360.jpg', 'https://android-screenimgs.25pp.com/fs08/2018/12/13/2/110_91ca9d0603f68ee1bccc8e1bf8ed4277_234x360.jpg', 'https://android-screenimgs.25pp.com/fs08/2018/12/13/7/110_94cb1628e4e27d6d815f90074bbe67e1_234x360.jpg', 'https://android-screenimgs.25pp.com/fs08/2018/12/13/8/110_4f75faa67643a640ef894f0f7e000d88_234x360.jpg', 'https://android-screenimgs.25pp.com/fs08/2018/12/13/4/110_deab95ea908ba6757adc6775ff223992_234x360.jpg']",上海量码网络科技有限公司,https://www.wandoujia.com/apps/com.xjlmh.classic/download/dot?ch=detail_normal_dl,  玩网名片美化 空间头像壁纸  , 4.6.0.000,7680843,460000, 4.6.0.000
字体美化大师,com.mylikefonts.activity,手机美化,4.5万人安装,10.08MB,https://android-artworks.25pp.com/fs08/2019/05/28/4/110_3a22d4c7d19052dcacb07467888e6af1_con_130x130.png,"在这个充满个性的时代里，你的手机还是一成不变的呆板吗？从现在开始，拥有自己的个性吧！在这里，你可以置身于字体的海洋里，选择成了永恒的话题。在这里，你可以放任自己，充分发挥你的设计灵感！当每一款精心挑选风格迥异的字体摆在你面前的时候，心中那份小小的激动是不是已无法抑制。来吧，让你的手机与众不同，开始华丽变身吧！咱的特点：1.本公司已与风投公司达成合作意向，融资后将给您的体验带来无与伦比的提升2.各大应用市场强力，匹配华为，小米，OPPO，三星，酷派，VIVO，HTC，联想，金立，魅族，中兴等市面上所有的机型。安卓5.0,6.0,7.0系统全部通吃。3.字体多。楷体，黑体，行楷，篆体，圆体，颜体，行书，少女字体，娃娃体等经典字体都包含4.根据用户反馈对字体进行了贴心分类，让您快速找到属于自己的字体5.完美支持陌陌，手游，，qq，，微博，京东，淘宝，天猫，头条等各类主流应用的字体更换6.整个应用全部实现云计算，云存储，云分发，字体更换就是唰一下 字体美化大师2019更新内容根据用户的信息反馈，升级以下内容：1.调整了字体的下载方式，下载更快捷。2.调整了美图秀的展示方式3.对字体的展示方式进行了优化4.对字体收藏进行了调整5.修复了其它功能 ","['https://android-screenimgs.25pp.com/fs08/2018/12/13/8/110_7578cf128a5de49f0190f717e5b6c94e_234x360.jpg', 'https://android-screenimgs.25pp.com/fs08/2018/12/13/2/110_91ca9d0603f68ee1bccc8e1bf8ed4277_234x360.jpg', 'https://android-screenimgs.25pp.com/fs08/2018/12/13/7/110_94cb1628e4e27d6d815f90074bbe67e1_234x360.jpg', 'https://android-screenimgs.25pp.com/fs08/2018/12/13/8/110_4f75faa67643a640ef894f0f7e000d88_234x360.jpg', 'https://android-screenimgs.25pp.com/fs08/2018/12/13/4/110_deab95ea908ba6757adc6775ff223992_234x360.jpg']",济南唐曾平创意设计有限公司,https://www.wandoujia.com/apps/com.mylikefonts.activity/download/dot?ch=detail_normal_dl,  字体美化手机管家  , 7.6,354901,92, 7.6
3D山水风景动态壁纸,com.android.app.wallpaper.mountain,手机美化,5.9万人安装,969KB,https://android-artworks.25pp.com/fs08/2016/06/07/10/1_35b0c5cda3e1051acb9068b0c79d6fe9_con_130x130.png,这是一款3D山水风景动态壁纸，独特动态效果，高清美景，给您的视觉带来舒适的完美体验。总有一处风景让你停下脚步，没有记忆，美得让你忘记自己的过去。,"['https://android-screenimgs.25pp.com/fs08/2018/12/13/8/110_7578cf128a5de49f0190f717e5b6c94e_234x360.jpg', 'https://android-screenimgs.25pp.com/fs08/2018/12/13/2/110_91ca9d0603f68ee1bccc8e1bf8ed4277_234x360.jpg', 'https://android-screenimgs.25pp.com/fs08/2018/12/13/7/110_94cb1628e4e27d6d815f90074bbe67e1_234x360.jpg', 'https://android-screenimgs.25pp.com/fs08/2018/12/13/8/110_4f75faa67643a640ef894f0f7e000d88_234x360.jpg', 'https://android-screenimgs.25pp.com/fs08/2018/12/13/4/110_deab95ea908ba6757adc6775ff223992_234x360.jpg']",winni工作室,https://www.wandoujia.com/apps/com.android.app.wallpaper.mountain/download/dot?ch=detail_normal_dl,  这是一款3D山水风景动态壁纸，独特动态效果，高清美景，给您的视觉带来舒适的完美体验。 总有一处风景让  , 1.0.2,6514444,3, 1.0.2
一键锁屏,com.iodkols.onekeylockscreen,手机美化,3.8万人安装,2.52MB,https://android-artworks.25pp.com/fs08/2019/04/15/10/110_c4a62b3cd1b5b5f6e4b9cc200fa22b00_con_130x130.png,一键锁屏，快捷锁屏，安全贴心。手机桌面上，点击“一键锁屏”图标，即可快速锁屏，减少手机电源键使用，延长其使用寿命。软件小，绿色纯净无广告，是您装机必备的实用软件。由于部分手机厂商的定制，如出现卸载不了的情况，请到“设置→安全→设备管理器”中去掉激活，再卸载就可以了。 一键锁屏2019更新内容修复了用户反馈问题优化用户体验 ,"['https://android-screenimgs.25pp.com/fs08/2018/12/13/8/110_7578cf128a5de49f0190f717e5b6c94e_234x360.jpg', 'https://android-screenimgs.25pp.com/fs08/2018/12/13/2/110_91ca9d0603f68ee1bccc8e1bf8ed4277_234x360.jpg', 'https://android-screenimgs.25pp.com/fs08/2018/12/13/7/110_94cb1628e4e27d6d815f90074bbe67e1_234x360.jpg', 'https://android-screenimgs.25pp.com/fs08/2018/12/13/8/110_4f75faa67643a640ef894f0f7e000d88_234x360.jpg', 'https://android-screenimgs.25pp.com/fs08/2018/12/13/4/110_deab95ea908ba6757adc6775ff223992_234x360.jpg']",北京多拓世纪科技有限公司,https://www.wandoujia.com/apps/com.iodkols.onekeylockscreen/download/dot?ch=detail_normal_dl,  一键锁屏安全实用  , 2.9.8,6621889,298, 2.9.8
指纹密码文字锁屏,com.yy.only.safe1,手机美化,7.6万人安装,4.23MB,https://android-artworks.25pp.com/fs08/2016/08/18/2/110_849b2f5a8ad8f856f10daadb2b0b4610_con_130x130.png,厌烦了别人随意打开你手机屏幕？想体验一把整蛊别人的快感？看某人不顺眼想调戏一下TA？独一无二的指纹密码锁屏，各种匪夷所思，各种意想不到，实乃打击偷窥者的居家必备利器！1.壁纸：多款指纹解锁动态壁纸随您替换使用，谁海量唯美指纹锁屏，美轮美奂，谁说指纹解锁就要千篇一律。2.便捷：选中主题，点击设置锁屏，录入指纹或密码即可。锁屏状态下，您还可以轻松查看时间，电量，天气，短信来电通知。3.安全：除了普通的九宫格锁屏或密码锁屏，更有独创的指纹解锁方式，除了你，谁也别想解锁你的手机！4.DIY：更多新奇的指纹密码解锁方式等你DIY，尽情发挥你的创意！兼具智能识别和娱乐功能，你的锁屏只有你能做主！ 指纹密码文字锁屏更新内容1.新增炫酷的DIY主题功能，随心DIY2.全新界面，改版提升多处用户体验3.程序猿哥哥优化多个反馈问题 ,"['https://android-screenimgs.25pp.com/fs08/2019/06/19/3/110_ecf3b516d353821a26ca0dbd065f10eb_234x360.jpg', 'https://android-screenimgs.25pp.com/fs08/2019/06/19/4/110_2d3e225af92163ab91a84cc65ef052e9_234x360.jpg', 'https://android-screenimgs.25pp.com/fs08/2019/06/19/5/110_af37a388b502d38963a3e112dbfb1e58_234x360.jpg', 'https://android-screenimgs.25pp.com/fs08/2019/06/19/10/110_4e548644651e3e906f8ce4e13da12381_234x360.jpg', 'https://android-screenimgs.25pp.com/fs08/2019/06/19/7/110_1f8443dce0f4fff777e09246ab46c62d_234x360.jpg']",深圳市朴朴电子商务有限公司,https://www.wandoujia.com/apps/com.yy.only.safe1/download/dot?ch=detail_normal_dl,  一款高逼格的指纹锁屏，唯美指纹锁屏新体验！  , 1.3.6,6621839,224, 1.3.6
内涵密码锁,com.tpad.change.unlock.content.nei4han2mi4ma3suo3,手机美化,6万人安装,8.87MB,https://android-artworks.25pp.com/fs08/2016/06/08/6/1_f7c0a27c90274016b6a596997df30f47_con_130x130.png,极具内涵的重口味内涵密码锁来袭啦！爱好各种内涵的朋友们来看看，绝对可以满足你的重口味。每天更新清新伤感、唯美温馨、3D酷炫主题壁纸，神秘星空，护眼壁纸，专业设计师团队倾心之作；定制个性多样密码锁，贴心守护每一刻；DIY全新秀场，与小伙伴分享自己的创意时刻，化身艺术家；超多明星偶像李易峰、鹿晗、赵丽颖、EXO、tfboys等你来；秦时明月、云中歌、盗墓笔记，只为喜欢电视剧的你；最高端：唯美清新、3D炫酷，可爱卡通，护眼壁纸，应有尽有；最有料：专业设计师团队，古今中外，包罗万象；最方便：本地在线，瞬间移动，指哪到哪儿；最安全：极难解锁，安全加密，打造史上最强大脑；最个性：超级DIY，私人订制，任意组合，随心所欲。最丰富的内容，护眼壁纸，唯美温馨、3D酷炫、可爱卡通，清新伤感，款款精品 ，总有一款适合您;最个性的DIY，下载DIY锁屏模板，可以制作属于您自己的锁屏，让您成为锁屏达人；最创意的解锁，解锁支持音效，超难文字解锁，等待文字控，支持重力感应的主题还有重力感应效果；最快乐的分享，制作好的DIY锁屏可以分享到您的社交圈，让您的亲朋好友一起使用； ,"['https://android-screenimgs.25pp.com/fs08/2019/06/19/3/110_ecf3b516d353821a26ca0dbd065f10eb_234x360.jpg', 'https://android-screenimgs.25pp.com/fs08/2019/06/19/4/110_2d3e225af92163ab91a84cc65ef052e9_234x360.jpg', 'https://android-screenimgs.25pp.com/fs08/2019/06/19/5/110_af37a388b502d38963a3e112dbfb1e58_234x360.jpg', 'https://android-screenimgs.25pp.com/fs08/2019/06/19/10/110_4e548644651e3e906f8ce4e13da12381_234x360.jpg', 'https://android-screenimgs.25pp.com/fs08/2019/06/19/7/110_1f8443dce0f4fff777e09246ab46c62d_234x360.jpg']",苏州天平先进数字科技有限公司,https://www.wandoujia.com/apps/com.tpad.change.unlock.content.nei4han2mi4ma3suo3/download/dot?ch=detail_normal_dl,  极具内涵的重口味内涵密码锁来袭啦！爱好各种内涵的朋友们来看看，绝对可以满足你的重口味。每天更新清新伤  , 3.6.12.8,6165206,488, 3.6.12.8
桌面萌宠,com.aswind.libdesktoppet,手机美化,3.9万人安装,16.96MB,https://android-artworks.25pp.com/fs08/2019/03/28/8/110_3894febcbdfea7c269736d64fafb26f0_con_130x130.png,《桌面萌宠》是一款独具一格的桌面宠物养成应用，超级酷炫的桌面萌宠养成大集合。内置30多种宠物可供用户选择，每个宠物都具有独特的声音和动画效果，【多种宠物随意选择】内置各种桌面宠物：皮卡丘、史迪仔、哆啦A梦、初音未来、大白、小黄人、长草颜、海绵宝宝、、守护甜心、阿狸、龙猫、蜡笔小新、小熊维尼、加菲猫、以及各种明星游戏角色等应有尽有【完善的宠物养成系统】喂养宠物可以有丰富的食物可供选择：包子、面条、粥、牛奶、药品、大力丸、回魂丹等各种物品，效果各异【有趣的学习打工系统】宠物可以通过学习：搬砖、挖矿、烹饪、种植、教师、医学、工程、科学、创造等各项有趣的技能进行对应的打工项目赚取宠物生活所需的金币 桌面萌宠2019更新内容1.取消长按宠物出现控制宠物界面的功能；2.调整宠物生长速度；3.增加AI语音功能；4.修复bug. ,"['https://android-screenimgs.25pp.com/fs08/2019/06/19/3/110_ecf3b516d353821a26ca0dbd065f10eb_234x360.jpg', 'https://android-screenimgs.25pp.com/fs08/2019/06/19/4/110_2d3e225af92163ab91a84cc65ef052e9_234x360.jpg', 'https://android-screenimgs.25pp.com/fs08/2019/06/19/5/110_af37a388b502d38963a3e112dbfb1e58_234x360.jpg', 'https://android-screenimgs.25pp.com/fs08/2019/06/19/10/110_4e548644651e3e906f8ce4e13da12381_234x360.jpg', 'https://android-screenimgs.25pp.com/fs08/2019/06/19/7/110_1f8443dce0f4fff777e09246ab46c62d_234x360.jpg']",宝鸡如风信息科技工作室,https://www.wandoujia.com/apps/com.aswind.libdesktoppet/download/dot?ch=detail_normal_dl,  酷炫桌面萌宠养成  , 1.5.2,7693345,14, 1.5.2
壁纸大全,bizhi.haomm.tianfa,手机美化,2.9万人安装,5.54MB,https://android-artworks.25pp.com/fs08/2019/01/03/3/110_98d12e90c097db9a34626d05f68444cf_con_130x130.png,有以久违相聚、恬静、腼腆等不同场景、不同阶段情调为主题的壁纸。随着手指轻轻地滑动，你可以从中感受到过去的美好、现在的幸福、未来的憧憬心动不如行动，赶快行动吧！还有头像图片哦，好玩的桌面美化APP、全球风暴、明星大侦探、蘑菇点点、秋田君、汤圆酱等众知名IP主题，更有形象神秘企划中！ 壁纸大全2019更新内容增加了头像功能 ,"['https://android-screenimgs.25pp.com/fs08/2019/06/19/3/110_ecf3b516d353821a26ca0dbd065f10eb_234x360.jpg', 'https://android-screenimgs.25pp.com/fs08/2019/06/19/4/110_2d3e225af92163ab91a84cc65ef052e9_234x360.jpg', 'https://android-screenimgs.25pp.com/fs08/2019/06/19/5/110_af37a388b502d38963a3e112dbfb1e58_234x360.jpg', 'https://android-screenimgs.25pp.com/fs08/2019/06/19/10/110_4e548644651e3e906f8ce4e13da12381_234x360.jpg', 'https://android-screenimgs.25pp.com/fs08/2019/06/19/7/110_1f8443dce0f4fff777e09246ab46c62d_234x360.jpg']",贵阳市欣欣快发科技有限公司,https://www.wandoujia.com/apps/bizhi.haomm.tianfa/download/dot?ch=detail_normal_dl,  壁纸分类更丰富哦  , 879,7859315,989, 879
360桌面,com.qihoo360.launcher,手机美化,3.8万人安装,12.22MB,https://android-artworks.25pp.com/fs08/2019/05/06/3/2_030ea12148babd39e2ae42bd8c78f2c6_con_130x130.png,【为什么你需要360桌面？】- 你感觉你的爱机越用越慢，越来越嫌弃它吗？,"['https://android-screenimgs.25pp.com/fs08/2019/06/19/3/110_ecf3b516d353821a26ca0dbd065f10eb_234x360.jpg', 'https://android-screenimgs.25pp.com/fs08/2019/06/19/4/110_2d3e225af92163ab91a84cc65ef052e9_234x360.jpg', 'https://android-screenimgs.25pp.com/fs08/2019/06/19/5/110_af37a388b502d38963a3e112dbfb1e58_234x360.jpg', 'https://android-screenimgs.25pp.com/fs08/2019/06/19/10/110_4e548644651e3e906f8ce4e13da12381_234x360.jpg', 'https://android-screenimgs.25pp.com/fs08/2019/06/19/7/110_1f8443dce0f4fff777e09246ab46c62d_234x360.jpg']",上海欧拉网络技术有限公司,https://www.wandoujia.com/apps/com.qihoo360.launcher/download/dot?ch=detail_normal_dl,  最接地气的实用、安全桌面软件  , 8.2.4,280329,8240, 8.2.4
今日头条,com.ss.android.article.news,新闻阅读,210.1万人安装,27.14MB,https://android-artworks.25pp.com/fs08/2019/06/18/4/106_9d7c18dcdaaecf14bd5bde362341f0ea_con_130x130.png,今日头条，懂你的信息平台官方精品应用  单用户使用时长超过76分钟,"['https://android-screenimgs.25pp.com/fs08/2019/06/18/0/106_63dc81d48403e25ecb2675a9d3274348_234x360.jpg', 'https://android-screenimgs.25pp.com/fs08/2019/06/18/10/106_89596b80d35943d2528e45ef4285cc34_234x360.jpg', 'https://android-screenimgs.25pp.com/fs08/2019/06/18/11/106_efbfadba26bd06e3e6d484e2d93e1686_234x360.jpg', 'https://android-screenimgs.25pp.com/fs08/2019/06/18/2/106_122761168c02719910929a373e00e82f_234x360.jpg']",北京字节跳动科技有限公司,https://www.wandoujia.com/apps/com.ss.android.article.news/download/dot?ch=detail_normal_dl,  你关心的才是头条  , 7.2.9,35609,729, 7.2.9
飞读免费小说,com.yuewen.cooperate.reader.free,新闻阅读,20.8万人安装,19.67MB,https://android-artworks.25pp.com/fs08/2019/06/19/11/110_064f65e4a5d0927ccda253f8834aac65_con_130x130.png,飞读免费小说，隶属于拥有海量原创小说作品的阅文集团，引进旗下起点、创世、言情小说吧等知名小说平台的百万正版热门小说。收录了如唐家三少，猫腻，打眼，鱼人二代，辰东，天衣有风，柳暗花溟，安姿莜，吱吱等诸多人气大神作家作品，妙趣横生，精彩纷呈。免费小说任性读，海量小说抢鲜看！【热门小说】《斗罗大陆》：你我皆唐门，生在绝世中。“唐家三少”最有影响力和代表性的小说之一，是你不可错过的玄幻巨著。《一念永恒》：起点白金作家耳根的仙侠巨著。跟随白小纯的追寻长生之路，领略宏大瑰丽的仙侠世界。一念斩千魔，一念诛万仙，唯我念永恒！《武动乾坤》：“天蚕土豆”的东方玄幻题材代表作，热播影视《武动乾坤之英雄出少年》原著小说。武之极，破苍穹，动乾坤！《庆余年》：白金大神猫腻的架空历史小说。一个年轻的病人重生到庆国，修行无名功诀，踏足京都官场，继承庞大商团。更有张若昀、李沁主演的同名改编电视剧即将开播！《鬼吹灯（盗墓者的经历）》：悬疑盗墓小说扛鼎之作，电影《寻龙诀》、《九层妖塔》原著小说。“发丘印，摸金符，搬山卸岭寻龙诀；人点烛，鬼吹灯，勘舆倒斗觅星峰”！【产品特色】百万册独家精品小说免费畅读，热门连载，永不断更！最全分类：都市生活，废柴流，系统流，悬疑灵异，异世大陆，寻宝探险，经商种田，穿越架空，霸道总裁文，浪漫青春文；分类齐全，只有你想不到，没有你看不到！一站式免费阅读，加入私人书架随时开读，让你享受畅读的自由。 飞读免费小说2019更新内容更新说明：1､书城升级：男女主编齐上阵，全方位消灭书荒2､特色推荐：【独家】精彩纷呈，【趣读】有趣有料 ,"['https://android-screenimgs.25pp.com/fs08/2019/06/18/0/106_63dc81d48403e25ecb2675a9d3274348_234x360.jpg', 'https://android-screenimgs.25pp.com/fs08/2019/06/18/10/106_89596b80d35943d2528e45ef4285cc34_234x360.jpg', 'https://android-screenimgs.25pp.com/fs08/2019/06/18/11/106_efbfadba26bd06e3e6d484e2d93e1686_234x360.jpg', 'https://android-screenimgs.25pp.com/fs08/2019/06/18/2/106_122761168c02719910929a373e00e82f_234x360.jpg']",上海玄霆娱乐信息科技有限公司,https://www.wandoujia.com/apps/com.yuewen.cooperate.reader.free/download/dot?ch=detail_normal_dl,  热门小说免费读  , 1.0.3.312,7926975,10003312, 1.0.3.312
今日头条极速版,com.ss.android.article.lite,新闻阅读,295.8万人安装,6.82MB,https://android-artworks.25pp.com/fs08/2019/06/14/9/110_c007f54160f8c8dd8b24664297cf0102_con_130x130.png,今日头条极速版内存小，省流量，使用流畅，为你提供有温度有价值的新闻资讯。【高品质内容】传递有温度有价值的新闻资讯。【热点及时达】热点新闻，及时聚焦，一键刷新即可触达。【海量内容源】时事，热点，视频，体育，财经，时尚，美女，汽车等海量内容等你来看。 今日头条极速版2019更新内容优化文章阅读体验 ,"['https://android-screenimgs.25pp.com/fs08/2019/06/18/0/106_63dc81d48403e25ecb2675a9d3274348_234x360.jpg', 'https://android-screenimgs.25pp.com/fs08/2019/06/18/10/106_89596b80d35943d2528e45ef4285cc34_234x360.jpg', 'https://android-screenimgs.25pp.com/fs08/2019/06/18/11/106_efbfadba26bd06e3e6d484e2d93e1686_234x360.jpg', 'https://android-screenimgs.25pp.com/fs08/2019/06/18/2/106_122761168c02719910929a373e00e82f_234x360.jpg']",北京字节跳动科技有限公司,https://www.wandoujia.com/apps/com.ss.android.article.lite/download/dot?ch=detail_normal_dl,  今日头条-看资讯  , 6.9.8,7472015,698, 6.9.8
凤凰新闻,com.ifeng.news2,新闻阅读,2877.1万人安装,33.89MB,https://android-artworks.25pp.com/fs08/2019/06/05/5/110_42f29684c7e5fa289513b88db5c6a40b_con_130x130.png,凤凰新闻就做不同，每天给你不一样的资讯信息。每日生活军事资讯头条趣闻，神吐槽、段子手、犀利评论、内部爆料，给你全新阅读新体验。身边人、朋友圈热门话题一屏掌握，精选内容独特角度，覆盖海量新闻资讯。〖要闻和兴趣模式一键切换〗下拉切换推荐模式，刷新最潮时尚、生活style、八卦，用得越久越懂你。 〖直播评论灌水点击前三思〗四美逛英伦、品味米其林、游戏动漫展……神评论脑洞大开，风直播带你飞。〖海量自媒体平台百家争鸣〗大咖、网红、草根、路人组团加入凤凰网，围观每个人思想的声音。［联系我们］任何意见建议、吐槽褒奖，这里找我们：凤凰新闻客户端内，“我”页面，写下意见；QQ群：397042134，粉丝互动热火朝天；小秘书微信号：ifeng-xiaomishu，随时接受咨询。［加入自媒体］专注兴趣、行业大咖，加入凤凰大趴体！入驻地址：zmt.ifeng.com客服Q群：4008191599 凤凰新闻2019更新内容【增加】历史记录删除，浏览记录可编辑；【优化】首页内容展示，热点资讯更及时；【优化】搜索功能体验，兴趣速报搜出来。如果有任何意见和建议，请在端内“我-反馈”中协助程序猿击杀bug ,"['https://android-screenimgs.25pp.com/fs08/2019/06/18/0/106_63dc81d48403e25ecb2675a9d3274348_234x360.jpg', 'https://android-screenimgs.25pp.com/fs08/2019/06/18/10/106_89596b80d35943d2528e45ef4285cc34_234x360.jpg', 'https://android-screenimgs.25pp.com/fs08/2019/06/18/11/106_efbfadba26bd06e3e6d484e2d93e1686_234x360.jpg', 'https://android-screenimgs.25pp.com/fs08/2019/06/18/2/106_122761168c02719910929a373e00e82f_234x360.jpg']",北京天盈九州网络技术有限公司,https://www.wandoujia.com/apps/com.ifeng.news2/download/dot?ch=detail_normal_dl,  热点话题明星趣闻  , 6.6.0,40363,661, 6.6.0
咪咕阅读,com.ophone.reader.ui,新闻阅读,37.8万人安装,36.26MB,https://android-artworks.25pp.com/fs08/2019/05/28/6/110_7f83f62e734094cc7dfa194580e9e471_con_130x130.png,【新用户福利看这里】新用户送至尊VIP，免费看书！每天签到，轻松领书券，看书不花钱！听有趣，阅不同，超5亿用户的选择。咪咕阅读汇集超50万册出版图书、原创小说、听书、漫画多种类资源。【热门好书】《显微镜下的大明》：“文字鬼才”马伯庸新作，于细微处读懂真正的古代中国！《天降巨富》：网文版《西虹市首富》，超级富二代装穷是一种什么体验？《隔河千里，秦川知夏》：唐家三少都市情感新作，咪咕阅读独家首发！《神医嫡女》：中西医双料圣手穿越成受虐嫡女，且看她如何拿下妖气邪王？《最佳女婿》：网文现象级热销书震撼来袭，引领都市女婿文潮流！【影视原著】《尸语者》：现象级悬疑品牌“法医秦明”系列开山之作，网剧播放量破16亿！《绅探》：同名腾讯热播剧原著，绅探白宇带你探秘民国上海滩奇案！《冰与火之歌》：口碑史诗美剧《权力的游戏》终章，文学巨匠马丁赐予的重磅成人奇幻！《致我们暖暖的小时光》：《致我们单纯的小美好》姐妹篇，顾学霸反撩上线！《暗黑者》：郭京飞领衔主演同名网剧，轰动欧美的中国高智商犯罪小说！【产品功能亮点】海量书库-超50万册正版图书，25万集听书，10万集漫画 特色听书-全球领先中文语音识别技术，所有文章支持语音朗读播放精美排版-300人团队精心校对排版，超优阅读体验让您手不释卷书友互动-提供借书、私信、签到、打赏、月票、晒书单等互动功能智能推荐-大数据智能推荐用户喜欢的书籍，打造个性化阅读体验【智能硬件体验】Kindle×咪咕电子书阅读器已全球发售，双平台一键穿阅，给你优质硬件体验【联系我们】官方微信：cmread365官方微博：@咪咕阅读在线反馈：打开咪咕阅读->我的->帮助与反馈 咪咕阅读2019更新内容1、进TA的主页可以查看TA写的精彩笔记了哦~2、优化了写笔记体验，交流更便捷，还有作者大大参与讨论！3、优化了其它细节，产品运行更稳定~ ,"['https://android-screenimgs.25pp.com/fs08/2019/06/19/0/110_0bc59badb30917ede86ec14aa5867c57_234x360.jpg', 'https://android-screenimgs.25pp.com/fs08/2019/06/19/0/110_a4c7122c372d1a05d8c90782b4920176_234x360.jpg', 'https://android-screenimgs.25pp.com/fs08/2019/06/19/2/110_29947d6781af87c3c86b94decd5468b6_234x360.jpg', 'https://android-screenimgs.25pp.com/fs08/2019/06/19/7/110_2c5e19e02ffff59aae202b375234b51d_234x360.jpg', 'https://android-screenimgs.25pp.com/fs08/2019/06/19/10/110_e001edf0f0491d9bdff68c5907a8c240_234x360.jpg']",咪咕数字传媒有限公司,https://www.wandoujia.com/apps/com.ophone.reader.ui/download/dot?ch=detail_normal_dl,  免费小说追书神器  , 7.9.21,280087,171, 7.9.21
